<?xml version="1.0" encoding="UTF-8"?>
<!DOCTYPE instrument SYSTEM "instrument.dtd">
<instrument>
    <!-- The instrument identifier -->
    <identifier>KANEOHE_CO2</identifier>
    <!-- The connection type: socket, file, or serial -->
    <connectionType>file</connectionType>
    <!-- 
      Configure connection parameters based on connection type. If connection
      type is socket, add hostName and hostPort below. If file, add filePath
      below. If serial, add serialPortParams and sub elements below.
    -->
    <connectionParams> 
        <filePath>
        		/Users/cjones/docs/dev/csjx/realtime-data/src/test/resources/edu/hawaii/soest/pacioos/text/KANEOHE_CO2-mock-data.txt
        	</filePath>
    </connectionParams>
    <!-- The name of the instrument source as it appears in the DataTurbine -->
    <rbnbName>KANEOHE_CO2</rbnbName>
    <!-- The IP or host name of the DataTurbine server -->
    <rbnbServer>127.0.0.1</rbnbServer>
    <!-- The port number of the DataTurbine server -->
    <rbnbPort>33333</rbnbPort>
    <!-- The number of in-memory bytes to request for this instrument source -->
    <archiveMemory>50000</archiveMemory>
    <!-- The number of on-disk bytes to request for this instrument source -->
    <archiveSize>31536000</archiveSize>
    <!-- The list of data channels to be created in the DataTurbine for this instrument source -->
    <channels>
        <!-- The default channel details. This will push ASCII data into the DataTurbine -->
        <channel default="true">
            <!-- The name of the channel -->
            <name>DecimalASCIISampleData</name>
            <!-- The channel's incoming data type -->
            <dataType>String</dataType>
            <!-- data archive example:
			# 100.86 , 429.8 , 396.1 , NaN , 34.71 , 26.62 , 2.70 , 2.19 , 193.81 , 6.20 , 189.54 , 22.62 , 08 Oct 2016 15:17:00
			# 100.96 , 473.5 , 395.5 , NaN , 34.74 , 26.59 , 5.66 , 1.67 , 184.19 , 5.89 , 180.12 , 22.65 , 08 Oct 2016 18:17:00
			# 100.94 , 472.6 , 395.4 , NaN , 34.74 , 26.85 , 4.25 , 2.01 , 197.30 , 6.31 , 192.96 , 22.57 , 08 Oct 2016 21:17:00
			# 100.74 , 453.0 , 395.2 , NaN , 34.74 , 26.99 , 21.00 , 8.98 , 202.75 , 6.49 , 198.30 , 22.52 , 09 Oct 2016 00:17:00
			# 100.77 , 433.1 , 394.5 , NaN , 34.71 , 26.93 , 10.43 , 7.35 , 211.02 , 6.75 , 206.38 , 22.52 , 09 Oct 2016 03:17:00
			# 100.93 , 421.1 , 395.6 , NaN , 34.71 , 26.88 , 4.43 , 5.11 , 204.38 , 6.54 , 199.88 , 22.54 , 09 Oct 2016 06:17:00
			# 100.98 , 424.7 , 395.6 , NaN , 34.72 , 26.81 , 11.38 , 16.58 , 200.85 , 6.43 , 196.43 , 22.56 , 09 Oct 2016 09:17:00
			# 100.85 , 436.8 , 395.5 , NaN , 34.73 , 26.78 , 2.18 , 1.62 , 197.68 , 6.33 , 193.33 , 22.58 , 09 Oct 2016 12:17:00
			# 100.81 , 456.3 , 396.0 , NaN , 34.74 , 26.75 , 7.86 , 6.84 , 196.25 , 6.28 , 191.92 , 22.60 , 09 Oct 2016 15:17:00
			# 100.93 , 445.9 , 395.6 , NaN , 34.73 , 26.73 , 16.43 , 9.23 , 191.19 , 6.12 , 186.98 , 22.60 , 09 Oct 2016 18:17:00
			# 100.96 , 442.6 , 395.5 , NaN , 34.73 , 26.91 , 25.46 , 19.47 , 192.84 , 6.17 , 188.60 , 22.54 , 09 Oct 2016 21:17:00
			# 100.78 , 449.2 , 395.2 , NaN , 34.73 , 27.25 , 4.21 , 0.50 , 196.55 , 6.29 , 192.24 , 22.44 , 10 Oct 2016 00:17:00
            -->
            <!-- example DT sample:
			curl -s -o - "http://bbl.ancl.hawaii.edu:8080/RBNB/KANEOHE_CO2/DecimalASCIISampleData" | od -ax
			0000000    #  sp   1   0   0   .   7   8  sp   ,  sp   4   4   9   .   2
			             2023    3031    2e30    3837    2c20    3420    3934    322e
			0000020   sp   ,  sp   3   9   5   .   2  sp   ,  sp   N   a   N  sp   ,
			             2c20    3320    3539    322e    2c20    4e20    4e61    2c20
			0000040   sp   3   4   .   7   3  sp   ,  sp   2   7   .   2   5  sp   ,
			             3320    2e34    3337    2c20    3220    2e37    3532    2c20
			0000060   sp   4   .   2   1  sp   ,  sp   0   .   5   0  sp   ,  sp   1
			             3420    322e    2031    202c    2e30    3035    2c20    3120
			0000100    9   6   .   5   5  sp   ,  sp   6   .   2   9  sp   ,  sp   1
			             3639    352e    2035    202c    2e36    3932    2c20    3120
			0000120    9   2   .   2   4  sp   ,  sp   2   2   .   4   4  sp   ,  sp
			             3239    322e    2034    202c    3232    342e    2034    202c
			0000140    1   0  sp   O   c   t  sp   2   0   1   6  sp   0   0   :   1
			             3031    4f20    7463    3220    3130    2036    3030    313a
			0000160    7   :   0   0  cr  nl
			             3a37    3030    0a0d
			0000166
            -->
            <!-- 
              The regular expression used to match a data sample.
              Best to keep the data pattern on one line below 
            -->
            <dataPattern>#\s*\S+,\s*\S+,\s*\S+,\s*\S+,\s*\S+,\s*\S+,\s*\S+,\s*\S+,\s*\S+,\s*\S+,\s*\S+,\s*\S+,\s*\d{2} \S{3} \d{4} \d{2}:\d{2}:\d{2}\s*</dataPattern>
            <!-- 
              The character that delimits variables within the sample
              Use Hex notation for non-printing, whitespace characters (like space)
            -->
            <fieldDelimiter>,</fieldDelimiter>
            <!-- 
              The character(s) that delimit records (samples) in a stream or file
              Use Hex notation for non-printing characters, separate characters with a pipe
            -->
            <recordDelimiters>0x0d|0x0A</recordDelimiters>
            <!-- 
              The list of date formats for each sample date component in a separtate variable
              One or more date formats are required, reflecting the date/time variables in the data
              Note: dateFormat and dateField are used together to locate, then parse the sample date
              -->
            <dateFormats>
                <dateFormat>dd MMM yyyy HH:mm:ss</dateFormat> 
            </dateFormats>
            <!-- 
              The list of date fields for each sample date component in a separtate variable
              One or more date fields are required, corresponding to the date/time variable positions in the data 
            -->        
            <dateFields>
                <dateField>13</dateField>
            </dateFields>
            <!-- The time zone identifier that the data were collected in -->
            <timeZone>Pacific/Honolulu</timeZone>
        </channel>
    </channels>   
</instrument>